CommentID,CommentText,Consensus_InfoSD,Consensus_EmoSD
9277,"Im totally fine, thank you for asking! Its kind of hard to leave, most people who leave are asked to never communicate with members of the church and vice versa. ",[2],[2]
9278,"Maybe try making some friends outside your church. If you can establish a support structure that's not associated with the church you may find it easier to distace yourself if you need to. Regardless, dont let anyone in the community pressure or guilt you into doing something you really don't want to (i.e. marriage, kids, or whatever).",[1],[2]
9280,"People forced to get married? Physical discipline? Sexualization of young girls? I dont care what label you apply to this group, its abusive and you should take all actions necessary to disassociate yourself from it.",[1],[2]
9275,"Please disassociate yourself with that body (I hesitate to say church) as soon as possible. It sounds very damaging. I myself left a church I consider a cult a few months ago, while for different reasons than you. This particular church seems to be less about God and more about sex, family, and earthly things. Jesus says store up treasures in heaven, which sounds nothing like what you describe. ",[2],[2]
9282,"Thank you! It was kind of hard to get away, again my family was very important to the church so I was usually given special treatment, so getting out was easier for me than if is for others. Its way harder to get out of you get married and have kids within the church. ",[2],[2]
9279,"Thank you, Im pretty lucky that I havent been pressured as much as the other girls. Im very lucky to be in the position I am in. ",[2],[2]
9284,This is absolutely a cult. Please get out,[1],[2]
9276,"This is not normal. This seems like avery dangerous environment. Are you able to leave? Religion can be a great thing, I've grown up religious in several communities of faith and still am. It was never like this. Are you ok OP?",[2],[2]
56635," In order to get past exactly that, I would trick myself. I would go to bed, and set an alarm on my phone for an hour later, knowing that I was so exhausted all the time that I would fall asleep right away. When my alarm went off after an hour I would wake up just long enough to put the mask on and then go back to sleep, to be awakened at the right time by my other alarm so I could get up and go to work. That worked for about a month, and ever since then I have not needed to do it anymore.

 It is totally possible to adapt to the mask. The annoying phase of ripping it off in the night is just another thing to push through. You got this.",[3],[2]
56632,I do customer service for a respiratory company and you wouldnt believe how many people call in with the same complaint try using it at night before going to bed while reading or watching tv it helps you get used to it while your awake. Most people tear it off at night because its unfamiliar if that doesnt work try a new mask! There are literally hundreds out there and sometimes it takes a few tries to find the right one!,[2],[1]
56648,I have pretty much not been able to sleep on my back for my entire adult life. Additionally I would never be able to sleep with a mask strapped to my face.,[3],[1]
56601,I was worried about tearing the mask off in the night as well. I kept it on last night so hopefully it won't be an issue. They make a few different style masks you could try. Personally I use the nasal mask where it just goes over my nose. I definitely suggest you try to make it work because sleep apnea is associated with an increased risk for a whole host of diseases.,[2],[2]
56600,"I went to try a CPAP machine after one of my previous girlfriends was scared I was dying in the night. Not breathing for 30 seconds to a minute sporadically through the night tends to unnerve the ones sleeping next to you.

I tried it for a bit, but I kept tearing off the mask in my sleep. I'm jealous you are able to sleep with it on, but it might be because I'm a side sleeper, although you make a good point about not being able to breathe on your back.

Maybe I should try one again...

Edit: wow, I'm overwhelmed with the responses. Thank you to everyone who has given me advice! I'll be going to my doctor about looking into an oral appliance.

Thank you again!",[3],[]
56612,"I'm a side sleeper and I have no problem with my mask.

I have a ResMed S9 APAP machine and I use the ResMed Quattro FX mask.

I love my machine. If someone tried to take it away from me I would literally kill them.",[2],[2]
56647,"Idk what mask you used but they make ones specifically for side sleepers. Mine has the hose at the top of my head, and the mask comes down with a little breathing nose piece that goes under my nose. The mask is squishy so it compresses when you lay on it. Took me awhile to get used to but once I did it was glorious!",[2],[2]
56642,"Try the ""nasal pillows"".  They are super small, comfy, and you can totally sleep on your side.",[1],[1]
56641,"You could try other mask. Heated tubes, etc sometimes it's just finding the right setup. Plus even if you tear it off after 4 hours, thats 4 hours of sleep you benefitted with it on.",[1],[1]
56617,"You need to sleep with me for a few months.  My then boyfriend now hubby had horrible sleep apnea and raised the roof with his snoring.  Additionally he was falling asleep at work and at the wheel of his car on the road.  I laid down the law and insisted that he use the machine he already had.  He would rip the mask off and I would wake up and slug him in whatever I could reach.  After a few months he can sleep straight through the night without my physical ""reminders"".  ",[3],[1]
6197,*gathers pitchforks and torches*,[1],[]
6196,"I agree, fuck that guy!",[1],[3]
6201,"If you REALLY wanted to make an impression (up to you), you might be able to do something about it. 

I am not a lawyer (and my lawyer fiance is currently sleeping, so I can't verify), but I think the first thing is look up the statute of limitations for workplace harassment. I don't know if you are currently 18 (since it seems like this happened awhile ago), or are coming up on it, but this is a lawyer's field day and you could easily be getting any kind of secondary education paid for. ",[2],[3]
6199,"In the UK that can be illegal. If your job has you sign forms about sexual orientation, birth gender, maiden names, shit like that 'for their records', it's a violation of the Data Protection Act to disclose that to other people. 
Kind of nice to actually have that shit be locked down.",[],[]
6200,"It's illegal AF in the US too, but unless a 16yo has parents willing to fight and financial support to dispute what happened then it just gets swept under the rug.",[],[1]
6203,Man. What a fucking douche.,[1],[2]
6198,"Maybe not, just remember the OP likes girls too ;)


But seriously what a bunch of small minded idiots... that lady and your manager. Disgusting people.",[2],[2]
6202,My (UK) school did this to me. Unfortunately this is when section 28 was still in place so our schools couldnt provide any support for lgbt kids.,[2],[1]
6205,"Omfg, it's like people think they can complain because THEY don't like the information that THEY ASKED FOR. Then ffs, don't ask for the information in the first place!! I'm sorry, fuck her.",[1],[2]
6195,"Yeah... fuck that guy. I'm a college tutor and one of my students wrote her essay about her sexuality. Her parents snuck onto her computer to read it and found out she was bi, and these are first gen don't speak English Asian parents and they were not cool with it.

Makes my blood boil when people aren't given the chance to come out on his/her own terms. I'm glad your step dad is cool with it. 

Fuck that guy.",[2],[3]
14661,I got lucky. My daughters father isn't on the birth certificate so I never had to deal with any of it.,[2],[2]
14662,"I was 18 and thought it was the right thing to do. He was there in the room when she was born actually, so I thought he had grown up. He hadnt. Shes almost 22, and hes still an idiot. Except now hes an idiot with 4 kids and two ex wives. LOL (we werent married) ",[3],[2]
14663,Mine will be 16 tomorrow and her father has never taken any responsibility. And he wouldn't try very hard when he tried to.,[3],[1]
14658,"Oh man! How awful! I firmly believe that dads should have just as many rights to their kids as a mother, but its not right when they think they can just show up whenever and take the child. Thats not only wrong, but its also traumatizing to the child. Its so unnecessary, and I can almost promise you (at least it was in my case) they do it to hurt the mother not because they actually want to be in the childs life. ",[1],[2]
14653,"Props to you and your kids!

Don't forget to get the legal aspects right though! Get a lawyer, get full custody while she is still out ""enjoying"" her new life.

Don't give her the chance to all the sudden change her mind because of selfish reasons and take the kids from you on top of it! ",[1],[2]
14664,"Thats so sad. I am so thankful for my husband who has been there since my daughter was 10. She considers him her dad, but I know it still hurts her that her dad is such a piece...
Im sure your daughter will be a strong person for having to go through that, bless her heart. Im sure shes wonderful. It sounds like youre a great mother. ",[2],[2]
14660,They will do it at some point either because they feel guilty or they just want to hurt you. The person who ends up getting hurt is the child...and then you hurt because you cant stand to see your child hurting. It sucks.,[1],[2]
14655,"This exact thing happened to a close friend of mine! Her daughters father wanted nothing to do with his kid (he finally met her for the first time when she was a preschooler). When the kid was school-age, his parents (who he lived with) kept pushing for visits. My friend, who lived out of state, sent her daughter to visit with her dad and grandparents a few times. One visit, they decided to just not give her back and file for custody instead. It took about a year, a lot of money, an attorney and many court dates (plus a domestic violence arrest of the father) before she finally got her kid back. Both parents have equal rights as long as paternity has been established. ",[3],[2]
14656,"Wow! What a horrible family! I was fortunate enough to have, not only my family on my side, but his family on my side as well. That went a long way in court when he had nobody except his wife to stand on his side. Glad your friend is past that now. ",[2],[2]
14657,"Yeah, it was pretty sad. She had been a single mom for all those years, he was super behind on support and never paid her. She put herself through school, worked, and didn't have a ton of family to help her. When they did this to her, she didn't have money initially for an attorney or to take off a bunch of work, travel several states away to file stuff in court.. it was really fucked up. OP, definitely get yourself into court to get this abandonment on the record with the courts! ",[3],[3]
15573,Classic offmychest title misdirection,[1],[1]
15581,I agree with you but I'm not bothered by it. It was a pleasant surprise.,[1],[2]
15577,I have been trying to lay that foundation in my young kid.  I always tell him no matter what he believes his mom and dad will always love him.  I hope I am as successful as you were OP,[2],[2]
15572,Me too. Good dadding OP.,[1],[2]
15570,"Seriously. I was like awww fuck here we go. Good job, Pops!",[1],[2]
15579,Seriously? I made an assumption. An incorrect one. There is nothing misleading about the title.,[1],[2]
15569,"This went the opposite direction I expected from the title. As a parent of 3 independent and thoughtful adult children I just want to say, good job. ",[2],[2]
15574,"When I saw the title I thought ""oh god another one of those idiots that cant accept someone with a different opinion than theirs""  

good job OP parenting and humaning for that matter.",[1],[2]
15571,Why's that? It makes sense that a Christian would want their kids to be christian as well. Avoid hell and all that.,[1],[1]
15576,^This so much. Congratulations on your great parenting.,[1],[2]
9519,"I am so angry for you.  If your mom is worth being called mom, she will listen, and get you all of the help you need.  I'm an internet stranger, but I support you.",[1],[3]
9532,"I'm really sorry this happened to you, I can't even begin to imagine what you're going through right now.

Tell your mom and go to the police, it's not too late and you have all the proof you need. It's not going to be easy, it never is, but you're right, this is no way to live, especially for a 14-year-old. I don't know you personally and can only judge by your writing, but it seems like you've got a good head on your shoulders and you know what the best course of action is right now. You're very brave and I'm rooting for you.",[1],[3]
9523,"If ur not close to your mom, shitty to say this, but she may or may not believe you. Confide to an adult you can trust and tell them full story that history on his computer might still be there and if there's an investigation maybe his computer can be confiscated and used as evidence. I'd gather proof such as texts. Abortion might not stop him from doing it again and dear, you're only 14. It pains me to read that you've looked into suicide. You are young and your life is precious. I am sorry you've been dealt this card in life. Please reach out to someone and get the help you need",[1],[3]
9527,"Maybe less to do with the husband, and more to do with the piece of shit son he raised. I hope he has to suffer the proper consequences for what he did to this poor girl. ",[1],[3]
9525,Thank you so much. I can only hope my mom is going to act as kindly as you guys are responding.,[2],[2]
9529,Thanks you so much for your kind words :). Im definitely telling my mom and Ill see how  it goes. I have to wait for the right timing when Im ready.,[2],[2]
9517,"Thanks. I know what I have to do. This is really hard but I need to do it soon.

 And I will keep you guys updated if I can.",[2],[2]
9518,"You can do this. You may feel weak after what he did to you, and because of your age and gender but you are far, far from weak. Tell your mom, if she won't help tell someone else who will and go to the police. I'd encourage you to seriously consider abortion over adoption as carrying a child to term at your age is unsafe and the physical and mental toll that will take on you is just too much...

After that, get counseling to deal with the emotional aftermath of this fucked up situation.

Hang in there. You can do this, you can survive this. ",[1],[3]
9515,"You shouldn't have to starve yourself or contemplate suicide over your stepbrothers actions. Also if you need to talk to someone but can't talk to your mom or family there are plenty of resources online or over the phone for people in exactly your situation. Honestly in my opinion your best option right now is to tell someone you trust in order for you to take the first steps of getting help. 
",[1],[]
9526,"it may not go well, she maybe in denial because like i stated she doesnt want to ruin her perfect little marriage but what about your perfect little life as well? it was ruined, things are different now and she needs to know what kind of man shes with.",[1],[2]
6696,"Cutting off friendships who aim to think of you that low or pull one on your husband like that, is the lowest of the low- imo and you should definitely cut all ties. ",[],[3]
6706,I applaud you.,[1],[2]
6692,I saw so many cheating scumbags in the army it was unreal.,[2],[3]
6695,My mom did it for 23 years. Happy for you,[2],[2]
6704,Or come back from deployment and find a pile of clothes in an empty place. I saw that a few times.,[2],[1]
6702,Thank you for upholding your vow of loyalty to the man you chose to love.  May nothing but happiness befallbyou and your family.,[1],[3]
6705,"The almost comical thing about it is, that all that begins after like 2-3 weeks or 2-3 months where nothing has really happened yet (no combat zone interactions, etc)

Its like you couldnt go 2 months without cheating? Are you serious?

I can understand a person getting lonely after say 18 months and needing companionship, but for most of these people it was like ok, now that I am deployed, time to cheat... hey, look at that person.",[2],[2]
6693,"This is really nice to see. And whether you decide to tell him that any of this happened or not, he is lucky.",[1],[2]
6703,"Your husband is a lucky guy. I deployed twice and I can't tell you how many times both men and women take it as a reprieve from their relationships and sleep with anyone they can. It's like they lose all sense of themselves out there. 

And this goes both ways. The spouse at home will jump into bed with anyone and everyone. It's insane. It was like an orgy out there. Even this one newlywed Airman who was in the same unit as me lost her mind out there and slept with a shit load of guys. Your never think it by looking at her but something about the idea of not getting caught makes them lose all sense of themselves. 

To reiterate, your husband is a **very** lucky man.",[3],[3]
6694,Your husband is so fortunate to have you as a wife,[1],[2]
54718,#lifegoals. Become a cool old dude and get resucitated by my even cooler neighbor. And then resucitate my neighbor when he has a heart attack and the cycle keeps on going until one of our hearts stops firing for good.,[1],[2]
54733,">i felt one rib crack

One emergency teacher once said me that if you don't feel a rib crack you're probably doing it wrong. Breaking a rib is definitely not a problem, letting your patient die is. 

",[1],[1]
54742,Am ICU nurse. If you're not cracking ribs you're not doing it right.,[2],[1]
54751,I've been through this as well. Did you have that unique metallic smell in your system for hours afterwards? I suspect it's related to adrenaline somehow.,[2],[1]
54690,"It may not hurt to schedule a short appointment with a counselor to just go over the situation and have them help you keep it from interrupting your sleep going forward. Things like that can stick with you, especially if you don't see it every day",[1],[]
54750,"Learned CPR as a boy scout when i was a teenager. It never occurred to me that, before you begin CPR, you'll have to have watched a man die in front of you. I'm sure that'll stick with me if I ever have to use it.",[2],[]
54726,"Shite that sounds intense, I always wonder what I'd do in that situation. I trained first aid but doing it in real life is completely different. Nice work, did you use the tune of 'Staying Alive'? ",[1],[]
54741,"There was a video on Reddit of a magician  that died during a performance and the whole crowd thought it was part of the act. He was doing that death noise you speak of. People should learn if they hear something like that to get help asap. Also, for peace of mind you should see if your neighbor would invest in a personal aed device. ",[1],[1]
54737,"What you heard is called Agonal Gasps. It is common for people to mistake this for breathing (I have no idea how) and stop CPR, but really they are dead and you must carry on. Well done to you, sir. I hope that neighbor gives you your beer.",[1],[2]
54689,"Yeah, I felt one rib crack but that was it. I was more focussed on the job at hand and controlling my stress. The weirdest thing was that when he was dead the air came out in this horrific groan/gurgle noise. That will stay with me. Didn't sleep too well last night but I'm sure that'll pass. Hope he pulls through, he is a cool old dude and a good neighbour.  ",[],[]
7823,Beautiful.  I hope you find happiness again.,[1],[2]
7832,"Every love we find in life is different and special. This new guy will never replace what you had with your husband but you will make something beautiful, special and new with whoever comes along. I'm happy you found someone who makes you happy because these things are hard to find - a hand that reaches out in comfort, a shoulder to cradle our heads and eyes that light up when we enter a room - I know it's not your husband but I would like to think he wants you to be happy and okay. Allow yourself spaces for grief because one day, those spaces will save room for happiness to move in. You'll still miss your husband but as you move through grief you'll realize that the years you spent aren't lost but yours to keep forever as part of you. I wish you all the best.",[1],[2]
7826,"For some reason, every word you wrote down, I was able to absorb all of your feeling despite I'm single and did not really have anyone who passed away other than my grand parents.

Thank you for sharing the story.",[2],[2]
7828,"I don't know what everyone else has said in the comments, so forgive me if this is beating a dead horse, but I think your husband would be/is relieved and happy to know you're finding pleasure like this once again in life.",[1],[2]
7824,"If he loved you that much there's no doubt that he would want you to be happy again. Putting away his things isn't forgetting him, it's a step in the right direction to move on. Now it's time for a new chapter for you. It doesn't mean he's forgotten, it doesn't mean he wasn't important. You realize it's time to let go and that's great because now you can give love to someone that obviously loves you in a great way. He would've wanted you to have that again.",[1],[2]
7825,"My boyfriend died. I know too well the feeling of being an empty shell, a ghost of your former self drifting around, and I'm sorry you had to go through with that.

He will never be your husband. But also, try not to compare him to your husband. He is not trying to replace him, nor could he ever achieve that to begin with. Continue to cherish the memories of your husband, but also appreciate this new man in your life with all of his own individual lovely qualities, quirks, habits, and reactions. ",[],[3]
7822,"Thank you so much for sharing this beautiful story. I know that it may be painful now and perhaps for even a longer time, but I'm sure that your husband would want the best for you and that he wouldn't want you to hold yourself back because of him. Keep moving forward. Don't ever feel guilty about being with another man or just moving on. He would want the best for you and so you deserve it. Good luck and I wish you the best!",[1],[2]
7827,"This made me cry. I'm sorry for your loss. Please allow yourself to feel happiness with this other man. I know it feels like you are betraying your husband. He's still a part of you. You're not doing anything wrong. Your husband would want you to be happy. This was a beautiful story , thank you for sharing.",[1],[3]
7829,"This post made me teary eyed, I'm trying to blink back the tears because I'm at work! Thank you for this beautiful post about your past as well as the future you are working towards. I hope you continue to heal and find happiness again someday soon.",[1],[3]
7831,"god bless you, let your husband go.....god bless you",[1],[1]
5095,"' If she does not buy it, itll pass to someone else. My mom is just so tired of the lies and being taken advantage of. My sister and I both support her in this decision.' 
great! a good time to cut them off! I felt so indignant and angry for you too",[2],[2]
5099,"Agreed, the kids have terrible behavior on any normal day, but they are victims of their circumstances. I hope they will find more positive role models to follow than their mom/grandpa.",[1],[2]
5096,"Im glad shes going this route, I feel like its the best way to not cause too much friction in the family, but still distance ourselves.",[1],[2]
5098,"Kids do irrational things, and sometimes they don't understand the consequences of their actions. But as an adult, the fact that your uncle allowed it to go as far as it did, and neither him or your cousin refused to offer to replace the flowers or even apologize for their behavior is ridiculous. I'm so sorry for your loss, and this is something that you are more than justified to be furious about. Good on you and your mother for taking steps to cut them out.",[1],[2]
5097,Let them know why too. Preferably after the sale it's completed so they take some sort of revenge act. They need to know this it's definitely not ok (in fact it is deplorable) after what you have done for them.,[1],[2]
5102,"Well our great uncle passed away last year and her dad did some underhanded things when our great uncle wasnt mentally all there and ended up getting half of his estate, taking from our other cousin that he originally wanted it to go to, so we know her parents have the money.",[3],[1]
5103,"Wow. Guess the apple didn't fall far from the tree, huh? Your mom is doing the right thing, and you are under *no* obligation whatsoever to forgive her for the things she has done. Sounds like you are better off distancing yourself from that side of the family for your own mental and financial well being.",[1],[2]
5104,"Yeah, charge extra for having the carpet replaced since she smoked inside. At the very least",[1],[1]
5100,You are very gracious considering the circumstances. I wish you the best.,[1],[2]
5101,"You don't need to forgive this, is unforgivable. She should get a special price on the house, 50K more than your mom wants. ",[1],[2]
