CommentID,CommentText,Consensus_InfoSD,Consensus_EmoSD
7220,"I think a lot of parents feel this way. It's a taboo subject to be honest about so it's something rarely discussed. My sister was 40 and had a baby with a complete idiot that ruined the life she had before. Now she says, ""at least I have my son."" I think it's complete bullshit. She went from a state job and owning her own business to welfare. That's an extreme example, but you're a human being with human emotions. It's ok to feel how you feel.",[3],[3]
7227,"I was so worried, coming in, that they'd try to brush it all over with butwhatabouts (smiles, giggles, Kodak moments), itllgetbetterswhens, or - worse - shaming. I am very relieved.",[1],[2]
7222,"It was a combination of lots of things. The kid's dad is an idiot, the kid has some special needs, bad decisions on her part, and she was left holding the bag for everything.",[3],[]
7212,"The best you can do right now is work around the kids. Get someone to watch them a couple evenings so you can spend time with your husband or get a manicure. Treat yourself to some nice underwear. Maybe not as often as before but sometimes. Leave the kids with their grandparents and go on a holiday just with your husband. Have sex everywhere again. It doesn't have to be black and white. You don't want to feel like you sacrificed something. This won't do any good to you nor the children. Trust me, I was an accident and always felt like my mom regretted me - it's not a great feeling. Try to squeeze out as much for yourself as you can. We only have this one life. ",[],[3]
7219,What thread did you read?,[1],[1]
7223,"Yes it's bad in America.  For the vast majority, both parents have to work full time jobs to have a normal quality of life.  Maternity leave is far from guranteed.  Vacation time is even less so.  Prices for basic staples keep going up while wages stagnate.  Public schools generally are worse than not good, they are a detriment to children.  ",[1],[2]
7225,"Yes the US makes it very difficult and expensive... No daycare, no support, maternity leave is iffy. I could go on and I  but it's too depressing. ",[1],[2]
7216,"You homeschool though. Otherwise you'd be waking up at the ass crack of dawn every weekday. At least that's how I remember life as a school aged kid. Everything else sounds spot on and realistic for the general population though, I think. Coming from someone without kids who couldn't be a stay at home mom.",[2],[2]
12596,Go find your happiness. You are totally allowed. <3,[1],[2]
12603,Im actually the breadwinner,[2],[1]
12592,"It's okay.

You're not horrible, just human. You and this person you married want different things. 

The world will still spin and things will go on. It's totally up to you.

I think the moping's probably a little about someone who is slowly realizing their convenience window is about to shrink. He'll live, and so will you. Don't put the kid in the middle and be adults about it and it's going to be okay.",[1],[3]
12597,"Not only is it okay, at this point you need to. For yourself, for your child, for your sanity. I spent over a year dragging my feet before my divorce but it was the best decision I ever made. I only wish I made the decision sooner. It will be one of the hardest things you ever do. But there is such happiness on the other side!",[2],[3]
12593,"Something about the simplicity of looking at it like this helps. I appreciate it, thank you",[1],[2]
12601,Thank you. I hope Im strong enough to do this. The financial aspect is terrifying.,[2],[2]
12602,"This is a bit controversial, but are you working at all?  I sometimes feel like the man's role as a breadwinner can be a lot to take on, and it can quickly become a source of resentment.  I only mention it, because you might find you both regain some happiness if you were financially independent and not relying on him to pay for everything such as therapy.  I know raising kids is difficult, but even some part time work where you can get some personal spending money or something might be good.",[1],[3]
12598,What was your situation like? What drove you to do it?,[1],[1]
12600,"You have one life to live and you never know how much time you have left. Do you want to spend the rest of your time here being unhappy for the sake of not making someone else unhappy? You already know the answer to this. Now reclaim your life for yourself. You'll also be setting a good example for your child. They'll see that it's ok if things don't work out and if they're ever in a similar situation when they're older, they'll remember your strength and will have the courage to make the best decision for themselves. 

Get things in order. Start coming up with a game plan and have a few backup plans, too. 

I'm sorry that you're in this spot but I really hope that this is one of your first steps in finding happiness. ",[1],[3]
12594,"you will be ok and so will he. If you are unhappy, he likely is too. You might both be staying because it's 'easier', but think of your kid. You guys deserve to be fulfilled, and your kid is better off with two parents free to find what they need in life.",[1],[3]
7844,"And have your children raised by the bottom of the barrel instead? Low wage employment is not going to buy nice day care. Also, working all week with nothing to show for it and having your children in an environment worse than your own home does't sound particularly rewarding.  ",[1],[2]
7839,"Could you possibly look into government childcare assistance? It could be worth looking into, and if you aren't sure if you can retain the assistance if you get a job, social services could answer your questions about how much income is too much income to qualify to see if it is worth it.",[1],[1]
7842,Doesn't matter. Psychologically you need to work. Even if all your money goes to child care. Do it. You will feel much better.,[1],[2]
7838,Exactly this. The local centers around here charge $165 a week per child. The monthly cost would be two weeks of work at my husband's current pay rate. Finding a job to supplement that may not even be worth it.,[2],[2]
7845,"I don't know -- wouldn't it be better for your kids if they weren't being raised full time by somebody who doesn't (I don't think this is the right word but it's the best I have)  resent them?  It might be better to work if only to pay for a nanny if that is what keeps you going.

My mom had to put her ambitions on hold because of her children (long story) and it effected us in a fairly profound ways. We weren't mistreated -- but we were affected ",[],[2]
7843,"If you don't have the money, it's not an option. ",[1],[1]
7836,"It's okay. This isn't your bag. 

Get a job. Get therapy for your kids. 

You need adult time too. ",[1],[1]
7841,Look into services that use Applied Behavior Analyses. (I know I posted this further down). I cannot recommend strongly enough how important it is that you find a program that use it. Most insurance companies cover a good bit of the fees too. Look into Early Intensive Behavioral Intervention programs near by! Good luck!,[1],[3]
7840,"That's something worth looking into. We fall just outside the bracket when it comes to wic and stuff, so that might be the case again. Can't hurt to try though",[2],[2]
7837,The amount she may have to pay in childcare for her to work could be more than her paychecks.,[1],[1]
9666,"A few students out of hundreds not liking her teaching style is normal. Ive hated teachers Ive had in the past because I felt like I never learned a damn thing from the way they taught. 


But 275 other students loved them so maybe it means they all suck and only I was the smart one to avoid the dingbat. ",[2],[2]
9665,Check out her students' reviews on her classes. People would change their entire syllabuses so they could avoid her class because she's such a dingbat.,[1],[]
9661,"I cried too. So did my eight and thirteen year old self who couldnt talk because of people like her. I just cant believe the anger towards Dr Ford. Its like she betrayed some secret code and talked- oh wait...Good women and men are finding their voice. We need to support them all. 
Edit: spelling",[2],[3]
9660,"I'm 47M live in middle upper class neighborhood in Cincinnati. I was at the high school football game last night. Simply amazed the at the number of educated ignorant women who live here. They were talking about how their son's in college had to protect themselves. Is it possible they didn't listen to the same testimony I did. I was in tears throughout Dr. Ford's testimony. Then Kavanaugh's shit show confirmed to me everything I thought about him. Honestly...if Kavanaugh had spoken with quiet composure and humility, he may have been more believable. My daughter is 17. I've been warning her and her friends about men who drink since she was 9. I've told her the most trusting father and husband after drinking isn't to be trusted alone. I've known too many good women sidelined by 1 bad experience.",[3],[3]
9667,Nah. Students generally don't take the time to write reviews on professors unless they are exceptionally bad at their jobs.,[1],[1]
9668,"No youd be surprised. Some students just write bad reviews because theyre idiots who didnt pass the class. I myself wrote a bad interview for a class I failed out of spite. Trust me, students will make time to spite teachers they dont like. ",[2],[2]
9664,"Public opinion is always shoot first and ask questions later. Thats how its always been. Thats also why the US isnt a true democracy but instead a representative republic. Were supposed to have legal safeguards against this, but weve seen the current administration blend the two into this obscene monster that takes from both but respects neither. ",[1],[2]
9659,"She is reality, she and women /men like her are the reason that Trump got elected, the only thing we can do is show up in November and vote, don't get complacent and don't be fooled, there are many people like her , that hold her beliefs, that don't speak up in public.",[1],[]
9662,Theyre the upper echelon. They hate it when people like Ford tell the truth. The truth is bad news for the status theyve come to know. This woman and Kavanaugh are of the same privileged breed...they naturally look out for each other. They may be educated but that doesnt mean theyre good people.,[1],[]
9663,"Whats odd to me is that Dr. Ford PhD is also of the same background (as Kavanaugh and possibly the Bosss wife) and she is a victim. How can anyone sit there and believe an educated and successful woman who was demeaned and scared is the one who is wrong?

Its not only about the echelon. We live in a shoot the messenger society too. 

Also not to justify any aggressors but I think we do in fact live in a Guilty until proven innocent court of public opinion. 

Both are toxic and need to be stopped. It is going to be hard in my opinion because of the way that society handles bad news. ",[1],[3]
8301,Gotta agree with you Jessica.,[1],[1]
8300,I think it would look a lot better in your favour if it was only him that cheated when you get a divorce.,[1],[2]
8295,Jesus Christ you both need a divorce and counciling,[1],[2]
8304,On the next episode of snapped....,[1],[1]
8297,"The kid honestly is most likely going to be impacted heavily depending on how far this goes. OP, it's time to make a decision while you have time.",[1],[2]
8303,Well hopefully no one gets murdered,[1],[1]
8302,Yeah...i dont think he didnt cheat on here,[1],[1]
8305,Yep. I still remember the thread when the dude came to reddit for advice about leaving his wife and she killed their kids iirc,[1],[1]
8299,"Yes.  Revenge is a dish beat served cold,  but
To what end?  Revenge?  Statically speaking, you will likely outlive your husband.

Are you SAYING OP, that you are no better than your husband because he looks ""at her"" in that way?  So, you MUST have an affair to get back, get even?

Great!  

Please do post on the aftermath.  Each.  Gory.  Tooth gnashing. Fingernails on chalkboard.
Bended knee.  Moment.

Good luck to you and yours.",[1],[3]
8298,Youre not wrong.,[1],[1]
17852,"I am so glad you made it home and that the dogs are keeping you company. I think they may be the best kind of company to keep right now. I've never lost a spouse but I do know what it is like to be really, really, really sad. As you take care of your dogs, don't forgot to take care of yourself too. Much love being sent your way. ",[2],[3]
17855,"I can't imagine what you're going through, but I'm sure she would want you to stay strong. Hang in there and don't make any big decisions while you're grieving. My sincere condolences. ",[1],[2]
17848,"I'm so sorry for your loss.


My husband passed away almost 4 years ago, and our loyal, wonderful dog has been one of the most supportive friends I have.",[3],[2]
17851,"I'm so sorry for your loss. 

You will find purpose again. It may take a long time and it isn't something you want to force. Just be patient and take care of yourself, your dogs and the other people close to you in the meantime. One day at a time. 

Hugs, man. ",[1],[3]
17854,I'm so very sorry for your lose. Hope you find purpose soon..,[1],[2]
17849,Just think about this; dying would put others through similar pain to what you feel now. Even your dogs would be feeling terrible.,[1],[3]
17853,My dad died two weeks ago and I keep hugging other people's dogs. It makes me feel better.,[2],[2]
17846,"Thanks everyone, I'm home, it still doesn't feel right, but I've got our dogs with me now and they'll help me keep going as I figure it out",[2],[2]
17857,"Whoa, I am so sorry you are going through this, especially at such a young age, both of you. Thank you to you, your wife and family for donating her organs to help others. Words are insufficient at a time like this. Just know many Internet strangers send you sympathy and condolences. We're a worldwide support group, open 24/7/365.",[1],[3]
17850,"Yeah, that's the biggest thing that keeps me going, I feel that I was there to be with my wife for this point in time and know now isn't my time, but there's still that part of me that I can tell is slowly shrinking that thinks all that matters is finding a way to get back to her.",[3],[3]
2541,">  Then if you can, go see a counselor and talk this over with a professional. This is way too much for you to try and figure out alone.

Or reddit, for that matter. We all will chime in our best advice and sincerest condolences but please get a professional. ",[1],[1]
2537,"I just learnt this recently, but sometimes what you feel isn't always right. There needs to be context and logic applied to the situation for it to make sense. 

He is a grown man saying very inappropriate to his daughter and that is and will never be your fault. ",[1],[1]
2534,"It's weird. All the things people are telling me, are the kinds of things I would tell someone in this position but it's hard not to feel like I'm the bad guy too. I don't get it but I'm working on trying not to beat myself up.

Thanks for your kind words tho. I never thought strangers' comments on the internet would be this comforting",[1],[2]
2535,"Its a very common feeling to feel as if you are the bad guy. As if you did something to attract his unwanted desire.  This is why its imperative that you talk to a counselor...you need to understand these feelings and know that it is not your fault whatsoever. 
",[1],[1]
2543,"Please don't think this is your fault at all. I've been in a similar situation and have kept it to myself for years so I know how much it can eat you up inside. My step father never outright said anything that blunt but he used to do really creepy things like not let me keep my door closed to my room at night, buy me skimpy stockings and clothes and offer to take my pictures in them (I trashed them), talk about my body. He was obsessed with trying to take photos of me. Looking back at them makes me sick because they look so sexualized (the poses, the angles). It didn't help that my grandmother also accused me of ""letting him molest me"". It still bothers me to this day because I never told anyone. I really suggest talking to someone or perhaps seeking therapy. I support you. ",[3],[2]
2544,"That's another thing I'm worried about if I tell - that they'll think somehow I brought this onto myself or may be lying. I'd like to believe my family would support me but I also know they wouldn't want to believe that he's basically a perv.

I'm sorry that happened to you. It is so violating. I'm thinking of talking to someone at my university campus - I really hope it helps",[3],[2]
2536,"There is no way you are the bad guy. You walk down the street, minding your business, and get robbed. Are you the bad guy? Hell no!",[1],[1]
2542,"This. One awesome thing I've seen on reddit a lot is the recommendation to seek professional help. It's really good advice. I hope you can find the answers you need, not just to help the situation, but for you to have better quality of life. Good luck OP. We're all routing for you. ",[1],[2]
2539,You aint the bad guy here.,[1],[1]
2540,You did absolutely nothing wrong! I am so sorry you are going through this!!! Don't you think your mom deserves to know?,[1],[2]
7007,Don't down vote  BBRodriguse! It's giving a compliment! LOL,[],[2]
6998,"I can totally understand this.  You do what you need to do too be happy. If youre happy. He loves you and you love him. You guys work. No reason for that negative bullshit. 

CONGRATULATIONS ON YOUR MARRIAGE!!
Peace, Love and Happiness to you both. ",[],[3]
7003,"I feel like you're me! We met on ToonTown online (don't judge) when we were 16 and have been inseparable for 8 years now. I'm against marriage though, so a wedding won't be happening at all. We may do the court thing if it's beneficial later in life though. ",[3],[2]
6999,"I got married to my best friend a few weeks ago , we announced a week or so later and everyone was sort of pissed that they weren't invited , but we could not have been happier.

We didn't have to spend a rediculess amount of money(we're saving for a home) , and we had the best time ever . 
Sometimes not dealing with the stress of an event is so much better than  accommodating to other peoples wants and needs. 

I hope you have an amazing life together and cheers !!",[],[3]
7006,I like your mindset....you single?,[1],[2]
6995,"My family is very judgmental and negative.  If I don't do things by their recommendations, they will twist my independent happy moments into bad things.  I distanced myself from them a while ago because being in that really brought me down.  Not telling them about some stuff isn't new.  His family makes big deals out of everything.  They might be happy about it but be very overbearing and gossipy.  They insist on big celebrations for everything regardless of what he or I want and we don't like to bring a lot of attention to ourselves in that way.  Our friends would be disappointed that there wasn't a big celebration where they could be invited.  

We don't want to deal with a mountain of everyone else's feelings, desires, and complications that come with those.  We just want to quietly enjoy it to ourselves.",[3],[3]
7005,"That will probably us soon! I'm graduating from grad school at the end of this year and looking for a big girl job lol. We've been living together for a few years now, but are still living around our families. I plan to move far far away, though. ",[],[2]
7001,This is so cool. My SO and I are in a similar boat- our parents are totally different and don't get along. Telling them about the marriage (we are discussing we haven't done it yet) would cause all kinds of annoying attention/uproar. Our plan is to go to the courthouse and just do the job. We live together and have a child and are in our late 20s. I'm so glad I read this and that you are happy with your decision! Congratulations !,[3],[2]
6997,Well congrats to you!,[1],[2]
6994,Why aren't you telling anyone?,[1],[1]
11033,"> there was nothing but hate left for me

Could be projection on his part.

You said he didn't help on raising the first child, he then promised he'd help with the second, he didn't do that either.

And the night before he again did not participate but did his own thing, for himself only. ""try to keep the girls crying to a minimum because he was at a good point in his show and that would kill his vibe.""

So I think at least part of that hate is about him and about his own shotcomings.",[1],[2]
11028,"I am so sorry for your loss. I don't know why the medical examiner did not go with Sudden Infant Death Syndrome to the death certificate, since genetic factors plays a role. Regardless, it is not your fault.

I hope you're able to get the support you need. Combined losing your child and how your ex is acting, I can't imagine how incredibly taxing that would be on you. Hoping for a brighter future for you",[1],[3]
11032,"I remember looking into his eyes that morning and there was nothing but hate left for me. I knew I had lost him and he would never forgive me. 

And that's the moment I knew my living daughter had to be my sole focus. 

",[2],[3]
11031,"Significant others should support each other in the bad times, not pass the blame. This is so unfortunate that it usually turns out the other way. Hope you are holding up there. Thank you for sharing with us such an intimate part of your life.
",[1],[2]
11027,"The word restraining order is scary for me -- when he filed divorce he also filed a BULLSHIT retraining order keeping me from having any contact with my toddler, for A month. He took advantage of the fact that autopsy reports hadn't come in and he was ""afraid I'd hurt our baby and might do something to our other child"". I almost ran into oncoming traffic when I read it and realized I was powerless until the hearing. 

I told myself I'd not do the same thing to him. 
However, I have also grown so much in the past 16 months and he's still as broken as he was the day it happened. ",[3],[3]
11030,"Ugh. I am so sorry. I feel angry for you since I agree from your post that co-sleeping isn't the cause. Perhaps you can reach out to support groups to talk about this? Wish you well

",[1],[2]
11034,"You're absolutely right. 

He'll go a week or so being civil with me and then all it takes is a bad day for him and bam I'm getting texts about how he should've taken me to jury trial.

I keep telling myself that I'm the one who went from a stay at home mom to working full time only 2 months after she passed and have not only maintained that job but been promoted many times. 

Meanwhile he keeps jobs for a week or so, quits in a blaze of anger, and spends all free time thereafter terrorizing me. ",[3],[3]
11025,You're absolutely right. That's the conclusion I keep coming too. I really hate bringing police and the legal system back into it anymore than I have to in the last year. But at the same time he is unstable and I need to set safe boundaries for my daughters sake. I have no more energy left to waste feeling like I did anything besides love my little baby girl with all my heart.,[3],[3]
11026,you absolutely have to.,[1],[2]
11024,you need a restraining order against him. I'm so sorry.,[1],[2]
8657,"All the best, hard decision but right decision. I hope you find a partner in the future who treats you properly ",[1],[2]
8653,I am moving to Baltimore. I am going to start buying warmer clothes and thicker jackets when I have enough saved up. I really haven't a clue about what I should get or need. I mean the coldest it gets here is 30's every once in a while we will get to the teens but that's only at night and it will be in the 30's by the time the sun comes up.,[2],[2]
8658,I honestly never want to be married or in love again. I never want to date either.,[],[2]
8655,"Never look back! Don't even fall for what bullshit might come out of his mouth if he ever tried to get you back. That behaviour is psychotic, if anybody treated their wife like that in front of me I would give them a reality check like no other. Good luck with the beginning of your new life, hopefully he just leaves you alone. For the record I'm 28m so this is coming from a makes perspective. ",[2],[3]
8651,"Thank you. I have battled with depression and anxiety for 6 years. I am ready to become a different person. I am ready to be happy. Most importantly I am ready to love me. I am scared bc I am moving so far away. I have lived here 23 of my 32 years. I am from a very small town in the south moving to a pretty big city in the north, that scares me. But I am ready!  ",[3],[3]
8656,"The bullshit has already been flying. Everything is my fault and he is happy and okay with how he treats me. I was/am very good at defending him so I know NO ONE saw this coming. I hope he leaves me be. I don't want a fight and I am giving him everything but my car. I am not asking for any monies and I have told him he can keep the home, land and everything. I just want my clothes and pictures. I just want a divorce and to be done. ",[3],[3]
8652,Where in the north are you going? Can we help you prepare at all? It's cold.,[1],[1]
8654,You go girl get out while you still can I've been there and the only way I was able to get out was the fact he had a heart attack and suffered a brain injury and it was then that the tie was broken... save yourself and don't look back,[3],[3]
8659,You will heal with time.  Don't be closed to future relationships but be wary considering your experience. There can be real love again without abuse.,[1],[2]
8650,"Youre doing the right thing. You are amazing for taking this leap and recognizing your worth and getting out. I was in a pretty emotionally abusive relationship and had zero self worth. Two years later, I FINALLY love me. Best and hardest decision I ever made was to walk away from the man I thought Id spend my entire life with. You got this. Much love and cyber hugs. ",[3],[3]
