CommentID,CommentText,Consensus_InfoSD,Consensus_EmoSD
11063,"Oof, this is a little too real for me. They are removing my uterus sometime next spring. I'm 23 years old. I've just watched six girls my age get knocked up ( totally unprepared, seems like they want the child to be an accessory that the grandparents raise) just in this year. Sorry to ramble. I'm kinda buzzed and my grade-school sensibilities of ""fair"" and ""not fair"" are way too strong right now. I would love to adopt in the future but I've also watched couples go through the heartbreak of having their baby (foster-to-adopt) dropped straight back into a horrific abusive mess because blood relation trumps all I guess. I'm so sorry, OP.",[3],[3]
11054,"Yeah it does. Its nice to know Im not the only one out there who feels this way. Nobody in my friends circle understands. But seriously, it cuts so deep.",[1],[2]
12502,"As someone who has been cheated on 7 times, I seriously hate people like you. I never ever give 2nd chances. Trust is ruined forever.

You probably also shouldnt be drinking alcohol around other guys at this point. ",[2],[3]
12503,"Be happy that he loves you and has chosen to stay with you, if it keeps you up at night I recommend speaking to a therapist. Yes you fucked up but it was a one time fuck up, and you were honest with your partner. Appreciate your relationship and be the best version of yourself moving forward, learn to be thankful and not be defined as who you were in the past, but who you are now and what you're doing to be the best you can be.",[1],[2]
12509,"For the simple reason that OP has come to the internet for empathy for a fucked up thing she did. Almost all replys are in the context of "" awww babe, chin up, we all make mistakes""... Yes we do, but we don't go to strangers to try and make us feel better about it. We go to the person we hurt and souly the person we hurt and try fix it and work on it and work on it and work on it and work on it, and truth be told.. OP will probably always feel like crap for what she has done, and rightfully so.

I'm not projecting, I stating that out of all human betrayals this is right up the top. ",[1],[3]
12507,"Good enough to cheat on him, who is to say it wont happen again sometime in the next 40 years? 

Good on him for forgiving you and trying to push through, but he shouldn't have too, that's the point of a loving, trusting relationship. ",[1],[2]
12506,Maybe not. But I'll try my best to prove otherwise. It's been going good for the last 4 years...hoping for another 40 at least :),[2],[]
12511,"Omg stop being an asshole. People make mistakes, its part of life. The important part is she learned, told the truth, and apologized. Get off your high horse ",[1],[3]
12510,She clearly had been working on it with her SO so Im not sure why your complaining about that. She just also feels regret and is looking for some support which doesnt hurt anyone.,[1],[]
12500,"That was a good post - I agree that to be human is to screw up. You need to learn from your mistakes and learn to forgive yourself.

Good luck",[1],[2]
12508,"Why are you being so negative for no reason? Jfc she clearly is struggling with it, no need to kick someone while theyre down. Take your projections somewhere else. ",[1],[3]
12505,You don't deserve him.,[1],[2]
7422,Absolutely agree. I hope everything works out!,[1],[2]
7423,"Being a new parent is really busy and it sounds like OP is exceptionally good at hiding what she's going through.

It's often very difficult to recognize mental illness just by observing someone. Internal experience is a huge part of mood disorders.",[],[2]
7421,"Could be not seeing, could be in denial that she's depressed and so isn't really as aware of it as he should be.  Either way, OP should see someone and talk to her husband.",[],[2]
7424,Depressed people are remarkably good at hiding their condition. I have worked through some serious boughts and have had to screw on that smiley face when at work or dealing with people.,[2],[]
7425,"Do NOT be ashamed. 
Please DO call your doctor today. You're not alone in this.
Tell your husband.",[2],[2]
7419,"I have felt that hopeless, and I cosign all of this.  OP, please reach out to someone.  If not your husband, then a friend, or your doctor, or a therapist.  Yes, even if you are taking medication already; this is the kind of thing that needs to be noted and attended to in order to improve your treatment regimen.  There's a lot of bullshit stigma about mental illness, but the truth is it's just illness.  You'd talk to your doctor about a broken arm, and it's okay and right to talk to your doctor about this.",[2],[3]
7427,Lock up the gun NOW and make him wear the only key on a necklace. Do it for him and for your baby.,[],[]
7418,"Maybe he should know. If you're drowning enough to reach out here, maybe the people in your life need to know that your depression is affecting you more deeply than they think.

Edit: Let me follow this up by saying you shouldn't feel ashamed. At all. I've never been in your shoes, but I know that its not something you should have to deal with alone. You're not a bad wife or a bad mother for it, and you shouldn't have to hide the pain you're going through if you think it'll make people happy.",[],[1]
7426,"Or if not your husband - a doctor is fine.  Preferably more than one.

You don't have to feel like this, OP.  You don't deserve to.  

And your child doesn't deserve to lose their mother!  

It gets better, and you have nothing to be ashamed of - just ask for help <3",[],[2]
7420,"What I wonder is, has he noticed the depression and not done anything to help or does he genuinely not know the pain she's in?",[],[1]
11918,"Can this relation has any hope of working out? Seems to me that the charm has gone between you and ur husband. Is it cuz he's old? I guess...

Child shouldn't be the only reason for you to be together with your husband. If it's gotten this bad that you cry yourself to sleep, then talk to your husband abt it that you don't want to be in this relation anymore. Then talk to someone close to you to help you out in this. Suffocating yourself isn't worth it. Ur life also matters. Though it's tough getting out of a marriage.

I hope you can get help.",[1],[3]
11920,"Dont set yourself on fire to keep others warm 
That just got me right in the gut. 
Thank you ",[1],[3]
11924,"His age was never a problem in the beginning but I feel he was trying to impress me so we went on dates and Nights out etc. Now we want different things, hes happy with his life, hes ok to finish work, have his dinner ready on the table, watch tv n go to bed. I need more social life. Ive always wanted another baby, hes said he doesnt want more children because he doesnt want to be an old dad. I guess the age gap is a problem now ",[3],[3]
11919,"I am sorry to hear this, I have never been married but I can definitely relate to your situation in many ways. I also live far from home, away from all my friends and family. You are still so young and I feel like it is time for you to make some changes. I am just getting out of a depression stage myself, don't let your thoughts define you. Also, don't give up on what you want. Go home, back to your family. 

I'll be honest, from what I read you really need to make some drastic changes. I say this because I have been away from my family and I have also suffered from depression. 

Don't set yourself on fire to keep others warm. 

Good luck",[2],[3]
11916,"I think it might be time for you to start considering ending the relationship since you'll be better off that way especially because of your mental health. If you don't even want to be around him and are miserable living where you currently are it might be time to face reality about that.

Take a good hard look at your marriage and how your life is right now and decide if it's something you want to continue. Is there anything else you can do that's less nuclear than ending it and leaving? Is there something he can do to change? ",[1],[3]
11923,"Just being honest, i feel like his age is one of the main factors to this problem you're having. I think its time to end the relationship so you can be happy. ",[1],[2]
11925,Just spend some time apart but keep in contact,[1],[2]
11921,"No worries, I am glad to be of help. My best friend told me that when I was with my ex girlfriend that I had no feelings for anymore, but I stuck around and made my life miserable to please her. 

See our situation is actually fairly similar. Have a great rest of your day!",[2],[2]
11922,"Take care of you love, if you're feeling this way it's definitely time to go home. Do what makes you happy!!!",[1],[2]
11917,"You should be honest, tell him the truth and get it all over with. Go back home, its difficult but read this short story from early 1900's about feeling the way you feel. Its called ""The Yellow Wallpaper"" its about a women who feels exactly like you do and wasn't quick enough to do anything about it. It should givw you the inspiration to march forward.",[1],[3]
8141,*Everybody* says that!  :-),[1],[2]
8137,"Audiologist here.  Yes, please, get a hearing test, if just to rule out.  ",[2],[1]
8136,Check the ears OP! Check the ears!!Man I hope this is the fix.,[1],[1]
8131,Get a babysitter for a night and go get a massage. Or have a friend or parent watch them. You need a break take one,[1],[1]
8144,"My sister's the same exact way. My parents got her a speech specialist when she was a kid and ever since, she talks nonstop. Things can definitely change and get better. ",[2],[2]
8143,"Sounds like my son when he was a tot, he didnt speak until he was about 4. 
Hes 26 and now I cant get him to shut up. 
Take a break and let nature take its course. ",[3],[2]
8142,Wow that sounds so much worse than what my parents went through! So glad you got it sorted. What a mess. I really hope OP gets his ears checked!!!!,[2],[2]
8145,"Yep.my niece didn't speak until age 4 and has never been super cuddly and never cries. She's now 9 and she's super smart and super normal. She loves to talk and sing and play. And my sister did both therapy or anything until she got some help from the state (preschool). It was so embarrassing when a kid smaller than my niece asked to play once, and my niece didn't respond and just ignored her. She sounds a lot like OP's kid. Just let your kid be himself and don't worry so much. Once he goes to preschool he will probably start talking. My niece's first word was ""mine"" haha. ",[3],[]
8139,"Yes absolutely.  Most often it's middle ear fluid which may or may not be infected.  No infection, no pain, no fever, but the kid's walking around as if he were trying to learn language with earplugs.",[1],[1]
8138,our sons both were checked by audiologists in the hospital right after they were born and passed that test. could there be hearing issues that come up later? i ask bc my 17 month old doesnt talk yet,[2],[1]
17723,"""Hang in there""...*maybe* could've used a better choice of words there buddy. Just a suggestion!",[1],[2]
17713,And he will make his boys lives worth living too,[1],[2]
17719,"I am sorry for your loss, and for your suffering. I have twin daughters, just slightly younger than yours. I can't imagine raising them alone, but it would be so much worse for them to lose both parents. 

The worst part of suicide is being left behind to figure it out, whatever it is. Be there for your children, show them her love that still lives deep inside you. 

I'm sending brotherly love your way. Even if you can't feel it, know that it is there. ",[2],[2]
17722,"I know it doesnt seem possible to have a different life than you expected, but be kind to yourself: it has only been a few weeks since she died. Give yourself time to get back on your feet. I know you think you wont be able to, but trust that you can  in time. Accept whatever help you need. Grieve in your own way. It wont always be as bewildering and harsh as it is now. Wishing you all the best; take care of yourself.
Edit: choice of words",[1],[2]
17715,"I'm sorry. I'm so sorry you're suffering. I'm so sorry that your wife lost her battle with herself. I wish I knew more of what to say. ""Time heals all wounds,"" etc. etc., when it reality, there are some wounds that it will never heal. I'll spare you most of the psychology shit other than maybe seeking some grief counseling. I can't tell you what to do with your life, but your sons need you. If nothing else, give it a shot for them. If it falls short, you tried. 

Best of luck, OP. I haven't been here myself, and I can't imagine the way you feel, but I'm so sorry. ",[1],[3]
17712,Im sorry for your loss. Your boys can make life worth living though.,[1],[2]
17724,"Oh shit. Thx, fixed",[1],[2]
17717,This is the closest thing I have to a purpose I can really feel besides my sons - being a testament to the misery that follows suicide. Thank you for this.,[3],[3]
17721,"Those were the gifts she gave to me, and it's now my responsibility to pass those good memories. I'm the carrier of her legacy now. I hold her beauty. I'm her testament. To myself. And to the world.

This sounds like the end to a really powerful short story.  Its a truly beautiful sentiment. I hope OP reads your comment and takes it to heart. His memory and love for his wife is what will make her real to her sons. ",[],[3]
17718,"Your post is so well written, so purely felt that it's one of those reddit posts I cannot dismiss as made up. 

As you talked about your wife's jawline in your hands, the smell of her hair, all the little nuances that made her *her* to you, I couldn't help but picture my own partner. She is suffering so strongly with depression, and so am I.  Lately I have been trying to focus on myself and improving myself, and detaching some of our codependence, and becoming strong for both of us. But your post makes me realize that I need to figure out a way to be there for her at the same time.

Thank you for sharing, and please keep writing. If you see this message, please PM me. I'm a good listener and am always looking for people to talk to online. ",[3],[2]
15960,"And take a pic, we wanna see!",[1],[1]
15958,"And then you need to bury that vault under several tons of concrete and install a blast proof, hermetically sealed door with a biometric authentication system that requires a blood sample from both you and your daughter to unlock. 

",[1],[1]
15959,And then you need to dig up the whole lot and put it on the moon.,[1],[1]
15955,Awwww that's so sweet!,[1],[2]
15963,Everything about this post is so pure. It brought a tear to my eye. I wish you and your family happiness in the future!,[1],[3]
15961,My heart! I am proud of you and keep being the hero!,[1],[3]
15954,Yes and put it in your office at work. I am 23 and my dad has one or two of my kid drawings framed in his office and it warms both out hearts,[2],[2]
15953,You HAVE to frame that drawing!,[1],[2]
15957,You need a copy so the original can be sealed in an archival envelope and kept in a temperature and humidity controlled clean vault.,[1],[1]
15956,"Yup, scan it, print out another and save it digitally.  Can't have too many copies, really.",[1],[2]
8623,"I know what you mean. Its not the same, but I can relate because my mom had a miscarriage, and as she was in the hospital hooked up to a bunch of wires and still not recovered, her friends came into the room to meet her and when they came in they started talking about JCP deals to each other, completely ignoring my mom. After a few minutes, I couldnt bear it and I told them to get the fuck out of the room.
I sometimes wonder how people can be so oblivious to anothers pain.",[3],[3]
8624,"I'm sorry for what you've been through. I had an emergency c-section at week 34 due to pre-eclampsia and no, NICU is no fun and neither is having a teeny tiny baby which you cannot hold or bring home right away.

&#x200B;

Your ""friend"" is horrible. Pregnancy brain (aka the crazies) can't even explain her awful behavior. ",[3],[2]
8629,"If you dont want to necessarily end the friendship with these people, you will have to at least be on guard. There will most likely be more of this type of vocal diarrhea coming out of her as your children grow up. For example, my kid has a speech delay, didnt speak til 4, I was excited when he started saying certain phrases, another friend stomped on my excitement saying Oh, my LO has been saying that since she was 18 months!  No shit. ",[2],[2]
8621,That was seriously insensitive of her. Im really sorry for what youre going through. I dont think you should call her your friend anymore.,[1],[2]
8630,"The one uppers...
Just celebrate all childrens success! Its a very easy concept that some find so difficult ",[1],[2]
8626,"We succeeded after 2 years and 2 miscarriages, so when my friends get impatient after only trying for a month, I get upset but try not to take it personally... because its literally not about me.

And this isnt about you either. It hurts when people are insensitive but often its not targeted at anyone in particular. People (especially pregnant ones) say silly stuff. Just avoid her and focus on your little one.

",[3],[2]
8627,"Wow, shes a real idiot for doing that. 

And Im sorry that you had to go through such awful time and youve lost a baby. ",[1],[2]
8622,"Yea I dont think I will. I hand knitted her a baby blanket and dont think Ill be giving it to her anymore. My husband and I will stay friends with her husband, but I dont think either of us want to be around his wife again. Hearing her name right now makes my skin crawl. ",[2],[]
8625,"Yea it was definitely her regular ole stupid brain and not her pregnancy brain.  Shes youngish, but so am I. I think she thinks having a baby is having your own personal dress up doll. They got preggo on accident and we had to actively try for around 7 months. I think when I was in the hospital it was all anybody could talk about in town and so she may think theres glamour in crisis. ",[2],[2]
8628,"Yeah, I'd say F her and stay away from her. Seems like a complete asshole! ",[1],[2]
10407,"Ahw cheers! Also, really? Like what/who? :o Yeah of course! Just hope it helps, I know it might not be worth shit right now. But on the off-chance that it could help, I figured I should go for anyway ^^",[1],[2]
10413,"Ha! Thats exactly what I say when people make broad generalisations about Americans before they realise I am one. 

Also, I bet youre a rarity in the West Country. Im not surprised you get a million questions.",[2],[2]
10410,"Haha sounds like a good idea!!! I do have to admit that when I meet people from other countries I ask the same questions  just to build a picture I suppose! Or maybe just being nose! 

I also find it funny when some of my friends from here introduce me to someone else saying this is x. She is from...  really bizarre! 

Dont take it to heart! They (mainly) mean well! ",[2],[2]
10409,How do you feel about bourbons though?,[1],[1]
10399,"It doesn't break community rules, it's just horribly insensitive and more than a little self-centered. You seem to completely lack self-awareness and are dismissive of the experience of other immigrants. Being an immigrant means never belonging fully to your new country. It often means being discriminated against for the color of your skin, for your cultural practices, for your religion, and having your children and their children face the same difficulties as you even though they were born and raised just because they look a certain way. As a white US->UK immigrant, your experience lacks the racial aspect of why it's difficult to be an immigrant. For you to effectively dismiss someone whose experiences as an immigrant have almost certainly been much more difficult than yours is insensitive and demonstrates a profound self-centeredness that doesn't make you easy to sympathize with.",[1],[3]
10417,"Kiwis are pretty awesome all told. I do love living here, and my experience is good 95% of the time! 

But there are times it's tough. When Vegas happened, I actually stayed home from work because I didn't want to deal with the questions and comments.take care of yourself and keep being awesome, and have a great day!",[2],[2]
10402,We use knives and forks in America too.....,[1],[1]
10408,"We're British. We like talking. We find your background interesting. I'm British Indian, born in England. I get it all the time",[2],[2]
10395,"Welcome to the experience of immigrants all over the world. I am an Indian who has lived in America for 9 years now and I still come across this at times. This is normal for people and it's okay to feel frustration but it is also alright to acknowledge that you will never truly belong the way that natives do. You belong to both cultures. Acknowledge it, appreciate it, and accept it. And feel free to point out that stereotypes work in both directions. I love to tell Americans what I grew up thinking they did as an Indian. That shuts them down fast and it creates dialogue and allows them to introspect.",[3],[3]
10418,You don't use knives and forks in America?,[1],[1]
4540,"> ""Clinton in the office is just bad news"" 

Im sorry this was a perfectly valid reason to not vote for her its the RNC and the DNC's fault for being so out of touch with their bases that we got handed two shit candidates.",[1],[1]
4538,"But it's NOT just backwater hillbillies, and that's the problem. It's the kids that really just as old as me (22) saying that we ""need to protect the country from terrorists"" or "" we can't have a war with Russia."" It's the old people who think that ""another Clinton in the office is just bad news"" or that ""free medical care is bullshit, back in my day bla bla bla. ""

There are obvious stereotypes that do exist but these are just average people. Why is it so hard to see that this is all very and truly wrong? That we made a choice based on lies and deceit?",[1],[2]
4543,"Good. I did as well. Would have rather had Bernie but second best will do, even if second best is a steaming pile of garbage. I'd rather have a steaming pile of garbage than a quasi-fascist Reality TV star running the show.",[1],[2]
4542,I voted for her in the general begrudgingly.,[1],[1]
4535,"I've just watched 4 of his videos and don't feel like he makes a lot of good points. Granted, I watched mostly political videos (gun rights, trump) so we're probably not starting at a good place anyway.

Do you have particular episodes that you feel highlight his channel best? ",[1],[1]
4541,If you really cannot tell how She was clearly a better option than the Benito Cheeto then I'm really sorry.,[1],[2]
4537,"It's because  some people need someone to blame, and the backwater hillbillies can't imagine that anyone white could ever do anything wrong. (Pennsyltucky citizen here.) They're the ones still living in the 1800s when women and blacks didn't have voting rights and ""america was great.""",[1],[1]
4536,"Nah but it's ok right? Since trump won the elections now we can just go around asking all the ""dirty mexicans"" here if they belong or not.

It's not like the USA has an absolutely MASSIVE Hispanic population or anything and it's not like they're doing anything other than TOOK ER JERBS so what does it matter?

Why? Why is race still such a massive problem? Why are we so ignorant as human beings to judge by skin color or accent or what country we come from? Why can't we be judged by how hard we work or how much we benefit society as a whole?

It's really petty and pathetic how we're treating people in the name of ""Making America Great Again.""",[1],[1]
4533,"Rule 1 everyone, please read it before you comment. Do not invalidate her.",[1],[1]
4534,"There's a YouTuber called ""Officer 401"". He's a Georgia Cop that talks a lot about this stuff. I recommend you check him out",[1],[1]
6391,"Backing this one up. Choose your state well and start anew. I understand that starting over won't be easy but it's doable and you will get to choose who is in your life. Because we usually don't choose that much, family is imposed and friends we make at work or at school and if the environment does not propose the same values that you have, you end up with a bunch of assholes. Do not hurt yourself, you seem like a strong lady and we need strong lady. I would've done the same. PM me if you need support or just to chat, I'm sure others have offered, please do it, don't stay alone in this.",[],[3]
6386,"Firstly, please don't do anything to harm yourself. This is absolutely something that will get better with time. 

I don't usually think of leaving the state as a viable option to escape one's turmoil but I think that's a very good idea here. Do you have the means? You said you took money to get a house... did you buy it? Can you get out? As you said, there's nothing for you there anymore. Even though this may blow over eventually, the damage it could do in the mean time could push you over the edge. Get out of that town, better yet the state, and don't tell them where you're going. None of them. Perhaps in the future you can have a relationship with your parents again but only if you want to.",[],[2]
6382,"I am not far from your town and I know quite a few people out and around the area who can offer any help if you need it, myself included. 

Please, don't do anything to yourself. I had a strange similar situation and please believe that you will get past this",[],[2]
