CommentID,CommentText,Consensus_InfoSD,Consensus_EmoSD
14148,"As I person who comes from a split family, parents divorced when I was 3, I'm 22 now. I ended up living with and being raised by my maternal grandparents. They took the approach as op, never did they lay a finger on me, other than a gentle slap on the shoulder or leg if I was back talking, even then that was followed by a long talk on why what I did was wrong. 

As someone who is in college for psychology I now fully understand the benefits of that form of discipline, it teaches the child morals and not fear. ",[3],[2]
14154,"Both of my parents were unfit, so Im afraid Id be a mixture which is even worse. ",[2],[]
14147,"I believe in this type of parenting 100%. You're a great dad, and your son will be a wonderful person as a result of the attention and discipline he received as a child.",[2],[2]
14153,"It was one of my biggest fears growing up. I have cousins who have shrugged and tell me 'Dad also did it, that's how it is' But no, it doesn't have to be that way.",[3],[2]
14151,"My father died, but same. I wanna cry happy tears over this post, however. Its beautiful to seen traumatized children turn into stellar parents. Personally I'm afraid to ever have children because I don't have an example set for ""good parenting"".",[2],[3]
14152,"Same here, I mean I think I'm afraid I would be like my father tho!",[2],[2]
14144,Thank you for being a great dad!  It will mean the world to your child and he will always know he is loved no matter what life throws at him.  Great job!,[1],[3]
14146,Thanks. I've taken a sort of tough love approach when it comes to discipline. My wife took some classes in college that involved child development and I took some of the stuff she would talk to me about and incorporate it into my methods. The most important thing I took out of it is that a kid has to learn he is being punished for what he did and that the punishment is not a reaction from the parents anger.,[3],[3]
14150,"You almost made me cry, saddly I didn't have that kind of relationship with my father and he abandoned us some years ago",[3],[3]
14142,"You sound like a great Dad. You reminded me to be happy I have a Dad like that. 


EDIT: Spelling",[2],[2]
12730,"> douchiness 

Thanks, that made me laugh.",[1],[2]
12735,"I am mad at myself for looking. I am mad that I had a reason to look.

The problem is it isn't some random guy. I have already seen him twice last month and will see him again this weekend. My wife is in a choir with him and the choir meets every week and my wife normally goes out for drinks afterwards. We have kids so I don't go to a quarter of the outings. I was at a whiskey tasting party this past Saturday and it was awkward for me. We were playing a board game and sexual innuendos were everywhere. Also since we have kids I had to go home early to relieve the babysitter.

Fuck we organized a Mardi Gras trip with an airbnb place booked and he will be there. We will be carpooling for hours..",[3],[3]
12728,I don't know why she thinks this other guy is a nice guy. He seems like a total douche for flirting with a married person in secret,[1],[2]
12731,"I know it sounds weird, but in his defense she started it.",[1],[2]
12740,It would not be helpful messaging her friends as I doubt they would appreciate being brought into this drama and would just make everyone feel uncomfortable. Better for her to just quit the choir if you are going to go nuclear.,[1],[2]
12738,"It's not your fault, has nothing to do with you! Other than your wife crossed a line that shouldn't of been crossed. & for her to want to continue to be friends with him ""after some distance"" sounds odd. 

If I were your wife and did that. I'd cut all contact to show you, and regain your trust. 


Seems all a little weird.

You have every right to be any emotion you please! For god sakes it's you're wife. You may want to copy and paste this to r/marriage. They're extremely helpful over there. ",[1],[3]
12739,She told me she was a little worried to cut all contact as they have a close group of friends and was worried about gossip. I told her then she is lucky I found the messages as my first thought was to messages her friends for answers. I might still do it.,[2],[2]
12729,"Yeah, but she's at least as much or more of a douche. She can't acknowledge the other guy's douchiness without simultaneously admitting her own.",[1],[2]
12736,"Your wife has a crush on him, it happens. What shouldn't be happening is your wife allowing herself to act on that crush. She really needs to put some distance between herself and that guy. That means no social interations, especially where alcohol is involved, as she has shown herself to be willing to engage in behaviours that are detrimental to your marriage.",[1],[3]
12732,"but he let it continue, knowing she is married to you. they are both at fault. i'm sorry you're going through this OP",[1],[2]
5759,"I read a piece recently that I think you'll appreciate: [The Sorrow and the Shame of the Accidental Killer](https://www.newyorker.com/magazine/2017/09/18/the-sorrow-and-the-shame-of-the-accidental-killer). The writer covers the story of Maryann Gray, who hit a young boy who ran out in front of her car when she was 22 and would be pronounced dead upon arrival at the hospital, how it affected her life, and more broadly, what people like Gray and you deal with.

Hopefully this article, and the organization the article mentions - [Accidental Impacts](http://accidentalimpacts.org/) - can provide you with some psychological comfort. From their homepage:

> We are good people who have unintentionally harmed others, in accidents occurring on the roads, at work, at play, or around the home. I call us CADIs (Causing Accidental Death or Injury). Most of us feel grief, guilt, and distress about our accidents. Over time, we learn that our mistake does not have to define us.

",[],[1]
5760,I want to thank you from the bottom of my heart for this comment. I spent hours last night on the website reading stories. It was honestly healing. Thank you so very much.,[1],[3]
5762,I was trying to remember this person. Im glad you posted this. I hope connecting with others helps op to heal,[1],[2]
5768,Maybe your mom and OP can talk?,[1],[1]
5769,My mom is tech illiterate and tech phobic and would probably be pissed  that I'm sharing her story on the Intercloud  for Goggle coins and perverts to read.,[2],[1]
5761,Puts a smile on my face to hear that it helped. It's always the little things :),[1],[3]
5765,Thank you so much. Thats a beautiful way to do something positive. Thank you for that perspective.,[1],[2]
5767,"Thank you. She's made peace with it for the most part. It's just really hard when the big holidays roll around and his family puts up memorials at that corner. Brings up a lot of emotion for her. But she is a decent woman and volunteers and works hard to contribute to society. My brother rides motorcycles too... around the same age as the guy she hit. That bothers me a lot some nights.  Good people, bad people, doesn't matter. Death comes to us all. ",[3],[3]
5764,"Thats very inspiring. I believe life is about perspective. This is great advice for healing purposes.
",[1],[2]
5766,"Well my heart ached reading that, I hope you and your mum's doing well mate. Hugs ",[1],[3]
8465,"As a parent myself, this was/is my biggest fear. Would wake up in the middle of the night to check breathing. I'm sorry for your loss. ",[2],[3]
8464,"He passed away in his sleep at 6 weeks old, SIDS.",[3],[1]
8461,"I am so sorry for their loss. I don't know how close you are with your neighbor, but small acts of kindness do not go unnoticed in hard times. If you have a chance, check in and ask them how they are doing. Loss and grief can lead to serious isolation, or at least the feeling of isolation. I hope your neighbors are getting the support they need, and that they find their way through the fog of grief. ",[1],[3]
8463,I don't want to be insensitive but I'd like to ask how did you lose your child?,[1],[2]
8459,I love this. You have amazing parents!!,[1],[3]
8466,"Thank you. It's every parents biggest fear. I had trouble sleeping for a long time, and now with my 5 month old I still wake up in a panic sometimes. The loss has definitely left some scars.",[3],[3]
8457,This is beautiful and you have amazing parents.,[1],[2]
8467,This post gives me hope for humanity. Utterly beautiful.,[1],[3]
8460,"Was just informed that a neighbor lost their 8 year old daughter to a rare form of cancer this morning. They knew it was coming soon, yet it still hit like a ton of bricks. I cannot even fathom the loss you guys have experienced and hope I never have to. Thanks for sharing this message of hope for a brighter future. ",[3],[3]
8458,What a beautiful family.,[1],[2]
13304,"I agree, at a minimum you should tell him so that if your stalker ever comes back, it won't be you alone this time. That is some terrifying stuff you have had to live through and I really hope this guy doesn't ever do that again to you or anyone else!",[1],[2]
13313,"If not, my recommendation would be to keep your eyes peeled and get photo or video.. Obviously not as easy as it sounds.. ",[1],[2]
13308,"My point is, I don't think they COULD issue a restraining order. The texts/calls that came from his number did stop. He has plausible deniability that some other random person was calling me from the office/store numbers. He has not contacted me in any way I can actually link back to him in more than 2.5 years. How can I trace that it was him who tapped something to a bus shelter 3 years ago? or wrote messages in snow, or spray painted a sign 3 years ago? I have no PROOF that it was him. They don't hand out ROs like candy, at least not in Canada.",[3],[3]
13306,"Since its so low key now what would I even say. Yeah I'm getting these voicemails of breathing and kissy noises a few times a month from random numbers, and I think its this guy who stalked me 3 years ago but I can't prove anything. Yeah, if he starts stalking me again in person then I can video him and have proof. At this point its just he said, she said. I mean yes, I have texts telling him to desist contacting me saved on my phone, but because he stopped using his own number it looks like he complied. I basically have NOTHING.",[3],[2]
13311,"So there's my point.. If that's the info you got that easily, I'm sure law enforcement could get a lot more info a lot faster.. What's the worst that happens? They say, sorry ma'am there's nothing were can do, but if anything else happens please call us right away... Then at least there's a record of it.. ",[1],[2]
13305,"This sounds like a WP, but it's not.. I'd say police are the way to go.. Communications with your husband are key too, providing you trust him to trust your judgement in not telling him until now.. 

If he's the type that would feel 'betrayed' by you 'hiding' this for so long, it may not be the best idea. ",[1],[2]
13307,"Well, a couple things here... You have his phone number, whether or not it's still valid is irrelevant.. So long as it was a fixed billable line, they'll be able to track down his info.. At the very least, you could issue a restraining order, thereby sending him straight to jail if he breaches it. Also, this gives the police a record of what's happened, just in case it does escalate in the future.. Cops don't take stalkers lightly.. You dont sound crazy.. Cops have to deal with lunatics and paranoid people all day.. I assure you they've heard crazier stories and worked with much less information.. ",[1],[2]
13310,"Yes, Even I was able to get his full name and address from his phone number as he called me from a landline. He deleted his facebook which I used to confirm his ID and I can't find any other presence of him online, or couldn't last I looked.",[2],[1]
13312,"You have a lot of information here. More than most people.
That creep is still making you behave differently, so he continues to control you, whether you see this, or not.
Please tell your husband, and the police. He could easily be trapped by you calling the number, with police present. Please stop letting him rule your life! He is a cruel man who has preyed on your sensitive nature. His behaviour suggests that he could be dangerous. Please report him before he damages someone more than he already damaged you!",[1],[3]
13309,"hmmm... you make a good point.. I still think talking to the police can't hurt.. They may say, we'll take a look at what you have and try to find out who it is.. For all you know, there's all sorts of evidence linking him to you via his personal paper trail.. Once the cops know who he is, they can do their own investigating.. That is if they decide they actually want to do a bit of work.. lol",[1],[2]
9321,"Are you (or him) military? Just the way you called him a Sergeant with no other context makes it seem that way, in which case I'm sure his commander would LOVE to hear about the way one of their NCOs is behaving off-duty.

",[1],[2]
9317,Even if he is a seargent go to the police station and tell em and show em the proof,[1],[2]
9327,"Go to the police with the pictures, and names of witnesses. That's absolutely not alright. ",[1],[3]
9328,"I remember something similar to this happened to me from a complete stranger at target once. It was the most terrifying, disgusting feeling and I'm so sorry this has happened to you, OP. Please tell a family member, friend, ANYONE, to help you report him and offer you support if your husband won't. This isn't okay. ",[2],[3]
9319,"If he's a sergeant I bet his superiors would LOVE to see how he conducts himself off-duty.

Crucify his ass. ",[1],[2]
9324,Op please inform the police,[1],[2]
9325,"Report him to his superiors. If he is doing it to you off duty he may be doing it on duty.

Im so sorry you had to go through that. ",[1],[2]
9326,"Report that sick fuck to the watch commander at his police department.


If he's so nonchalant about doing this shit to you at a party filled with people watching, imagine what he does to other people when no one watches. Or what he does behind the badge.",[1],[3]
9318,She also could have meant seargent in the military?,[1],[1]
9323,Wow I'm so so sorry that happened to you and please tell your husband (if he doesn't know) because if I were him that guy would either be in court or with a Knife in is heart.it makes me angry that this happened to you.fuck I hate those people who do things like that god I'm actually triggered (I did see the warning ),[1],[3]
9383,"As someone who was raised by a mom in a similar situation as yours, please don't take it out on your daughter. Don't neglect her. She's just a kid, love her as much as you can.

Most of my emotional problems and lack of confidence come directly from how my mom raised me. I'm sorry about your situation but please please don't take it out on your child.",[3],[2]
9374,Hello and sorry for what you're going through. Isn't your child a citizen of that country? I think you might get a residency permit if you're the mother of a citizen. Do you know if it's possible?,[1],[2]
9372,"Honestly from the sound of things it doesn't seem like a daycare will be a fix all solution.  If this is how your husband treats you that's kind of a red flag.  I'd personally say going back home would be good for you.

Edit: Also possibly counseling could be an option perhaps?",[1],[2]
9371,"I have. So many times. And he either changes for a little while then goes back, or basically belittles my feelings. At this point, the marriage is over. I'm just at the point where I am waiting for news about daycare, because that will be the difference between staying here and having to go back home. I will need a working visa to stay here, as my spousal visa will be null once we get a divorce, and I can't work if I don't have childcare.",[3],[2]
9376,"If you are staying home and not working then you guys need to share your finances. His money needs to be your money, end of story. You should not be asking for money. You guys need to sit down and discuss this and come to agreements about what is acceptable spending and determine a budget. Your relationship will continue to deteriorate if you guys cant do this. 

Seriously, get your name on that bank account ASAP.",[1],[3]
9375,It should in theory be possible but even if he pays child support it won't be enough to live on if I can't work full-time.,[2],[1]
9379,Sounds like you need some help. Resenting your child is never a good thing. Obviously your husband is not in it 50/50 with you and that needs to change or you need to leave. Sounds like youre having a rough time. Hope you can get the help you need (and kick your husband in the ass!).,[1],[2]
9378,"Thank you for you story, advice, and kind words. ",[1],[2]
9382,Thank you so much for your kind words.,[1],[2]
9373,"Yes, if I want to stay here I will need the work (which means I need childcare) but I think the real problem is the unsupportive husband. He thinks counseling is a waste of money just like the meds/therapy I was getting for depression so I think he isn't interested in working it out.",[3],[]
5595,"1. Im so sorry this happened to you OP. 
2. I would purge everything that belonged to him and her and just cast it out of your life. 
3. You dont HAVE to be around for the holidays. Honestly, you shouldnt be around a situation that toxic.  I recommend going to a therapist and getting this frustration out. Hit up a gym and work out to get all the tension out. 

This is a time to be kind to yourself and not beat yourself up. Reject those two from your life and if you choose to forgive , do it for the sake of your own mental health. 

But fuck them, theyre awful. Move on to other things. Better things. When you show them you dont dwell on their shitty personalities, theyll see they fucked up. Plus Karma will get them soon. ",[1],[2]
5602,"Do NOT remain involved in their lives. Their level of betrayal is absolutely heinous. Dont play happy little Aunt for holidays. Let them explain why youre absent from family events. You did nothing wrong here. They each made a choice, and not once did they care about your feelings. Time to live your best life. ",[1],[2]
5599,"Everything Delta said, but also I would definitely not go to anything during the holidays where they will also be. If your parents and the rest of your family aren't willing to back you up on this (in terms of making sure you'll feel comfortable being there), they have no right to complain if you don't go to them for Christmas or whatever. Book yourself a nice holiday instead, or go see friends, and if you still do want to see your parents, go another time before or after the holidays.",[1],[2]
5601,"God damned right. I used to do this when things with the family were just not going to be ok...You are never obligated to subject yourself to horseshit ""because it's the holidays"" Go do something for YOU.",[2],[2]
5604,"I think you don't have to torture yourself remembering everything, it's a 20/20 hindsight situation, you obviously can tell he was lying now but I think you did the right thing trusting your partner, even if it backfired, he is in the wrong not you. 
I also think you should skip thanksgiving and stuff you know they will attend for a while since it'll be hard to watch and not good for you at all. Just spend it with a friend or don't do anything at all, who cares about holidays anyways? 
Feel free to pm me if you need to vent. Stay strong, you are better on your own!",[1],[2]
5603,Thats the attitude to have!!,[1],[1]
5598,"This this this this THIS.

Be glad you found this out now, before you had kids together.

You have my respect for handling this probably a lot better than I would; do what I did when my now ex-fiancee cheated on me earlier this year. Cut them out, work on yourself for a while, don't look back.",[3],[2]
5597,"You also dodged a bullet, in a way. You have no children with him, so you are not tied to him for the rest of your life. You can cut them off clean, and do separate things with your family. You can go completely no contact with your sister and your ex husband, if you choose. You can be happy. You will be happy. ",[1],[]
5596,"You know what? Youre absolutely fucking right. The only way Ill get over this (at all) is if I pick myself up and become happy without them. Theyre the ones who fucked up so I dont deserve to beat myself up over it forever.  I know its going to be hard, but youre right. Thank you :)",[2],[2]
5600,"You took the words right out of my mouth! 

""Oh sorry I won't be there for Thanksgiving... I'll be in Maui... Oh, and Christmas... Sorry I won't be able to make it. I'll be in Vail. Have a nice holiday season though. Take care!""",[1],[2]
5232,"> suffered massive internal trauma

????



",[1],[1]
5229,"Hey  just your friendly internet lurker here  , yknow the one youve never met knows fuck all about you but is now going to offer some advice ... here goes ..sorry to hear about the death of your partner thats horrible and you are allowed to grieve theres good and bad days and please have a beer...but  for the sake of those (sometimes) beautiful children you need to pick yourself up and keep going ,  he lives on through your children who love you and need you.. theres having a cold one after a hard day but I think you know you are drinking a bit too much... you found yourself here on the internet and there are support groups and we can all help you , grab your friends and family hold them tight... you made it though today... well done xx",[1],[2]
5230,"I agree with everything said here.  But, Id like to add a bit of advice.  OP youre drinking on average 10 beers per day.  Please dont stop cold turkey.  Believe it or not, you are at risk of detoxing.  Detoxing on your own can be fatal.  Please seek out the help of your doctor.  

Please know too, that good medical and mental health professionals exist.  The good ones dont judge and theyre trained to give you the support you need in the hardest times. 

Im so sorry youre going through this.  I honestly cant imagine how hard it must be.  As the user above said, you made it through today.  We all know that sometimes just making it through the day is a victory.  But, know that you dont have to do it alone and you dont have to resort to alcohol.  ",[1],[2]
5235,I get. But I'm talking about trauma so deep to a person's insides that it actually damages the brain.,[1],[1]
5241,"I'm so sorry to hear about your loss, this is utterly heartbreaking.
Thank you for reaching out to us, it's very strong of you! By doing this you're already faring  better than many others in your position. Keep moving, and keep talking about it, cry hard outloud for relief. Find others in the support forums who have been through similar situations, and keep posting sweetheart.

",[1],[2]
5236,"It's still Emotional Trauma.

Emotional Trauma can cause some severe abnormalities in the brain. PTSD, Disassociative Disorders, Identity Disorders, Selective Amnesia, Sleep Disorders, Depression, Anxiety, etc etc..  All of these can be caused by Emotional Trauma.

Emotional Trauma is every bit as serious as Physical Trauma.",[1],[1]
5234,"Just an FYI. Internal Trauma is something completely different than Emotional Trauma. I don't think /u/unreqistered was trying to be an ass for pointing it out. He may have been legitimately confused with your phrasing.

Internal Trauma means that your internal organs are ruptured and bleeding.

Emotional Trauma is the type of trauma that has to do with your mental well-being.",[1],[1]
5231,"OP has suffered massive internal trauma/loss and likely has high levels of fear about her future and raising two boys without their father. The alcohol kills the pain and helps OP to check out of reality (disassociation). The ONLY way forward in a healthy way is to stop with the painkillers, stop disassociating, begin to connect with all of the pain and trauma, feel the feelings, and begin to express and feel and then begin to heal and recover. For many of us this isn't something that we have ever learned very well from people that are healthy, so many times it helps to get some outside help. And finding healthy people amongst the helpers can prove difficult. Get some help if need be, but choose wisely. ",[1],[1]
5238,"the word you want is ""emotional""",[1],[1]
5240,"there is a degree of difference between Emotional and Psychological.  A death, being fired, divorce are all emotional events that can lead to a depressed state, which may in turn create behavioral issues.  But one can feel great remorse for an extended period without suffering from long term psychological issues",[1],[1]
2102,"I am so incredibly happy for you! I had lost my engagement ring and was completely heart broken. My husband was like ""we're just gonna buy you a new one"" but it wasn't THE one. I end up finding it under the car seat looking for the Starbursts that I dropped. Which is weird because we've vacuum the car more than three times. ",[3],[2]
2092,"I want to tell everyone!  Thank you!!!!!!

But I can't.  It's embarrassing we pawned it. 


Since we did he's bought me 7 more rings.  I have them all but this one, will never leave my ring finger, again ever!",[3],[2]
2093,"It's like an amazing quest. I don't think you should be embarrassed, you made a sacrifice for the better and for a while you were without. You went through SEVEN rings before finally, your sacrifice was returned. It's a beautiful story!",[1],[2]
2098,So now you can sell all the inferior rings to the pawn shop to make up the money you spent to get this one back!,[1],[1]
2100,This has completely brightened up my day :),[1],[2]
